{
  "$schema": "./feature-maturity.schema.json",
  "description": "Feature maturity levels for memory-xx. This file defines which features are stable, beta, experimental, or dangerous.",
  "version": "2026-06-09",
  "features": [
    {"id": "memory:write", "name": "Memory Write", "maturity": "stable", "surface": "api", "default_mode": "enabled", "risk": "low", "evidence": "Postgres ledger, idempotency, tests"},
    {"id": "memory:recall", "name": "Memory Recall", "maturity": "stable", "surface": "api", "default_mode": "enabled", "risk": "low", "evidence": "Qdrant backend, reranker fallback"},
    {"id": "memory:review", "name": "Memory Review", "maturity": "stable", "surface": "cli", "default_mode": "enabled", "risk": "low", "evidence": "Manual approval workflow"},
    {"id": "memory:approve", "name": "Memory Approve", "maturity": "stable", "surface": "cli", "default_mode": "enabled", "risk": "medium", "evidence": "Manual approval"},
    {"id": "memory:reject", "name": "Memory Reject", "maturity": "stable", "surface": "cli", "default_mode": "enabled", "risk": "medium", "evidence": "Manual rejection"},
    {"id": "memory:archive", "name": "Memory Archive", "maturity": "stable", "surface": "cli", "default_mode": "enabled", "risk": "medium", "evidence": "Manual archive"},
    {"id": "memory:status", "name": "System Status", "maturity": "stable", "surface": "cli", "default_mode": "enabled", "risk": "low", "evidence": "Runtime status, Postgres, Redis, Qdrant"},
    {"id": "memory:doctor", "name": "System Doctor", "maturity": "stable", "surface": "cli", "default_mode": "enabled", "risk": "low", "evidence": "Health diagnostics"},
    {"id": "memory:platform-doctor", "name": "Platform Doctor", "maturity": "stable", "surface": "cli", "default_mode": "enabled", "risk": "low", "evidence": "Platform-wide health"},
    {"id": "memory:mode", "name": "Runtime Mode", "maturity": "stable", "surface": "cli", "default_mode": "enabled", "risk": "low", "evidence": "core/enhanced/full profiles"},
    {"id": "memory:up", "name": "Runtime Up", "maturity": "stable", "surface": "cli", "default_mode": "enabled", "risk": "low", "evidence": "Enable runtime"},
    {"id": "memory:down", "name": "Runtime Down", "maturity": "stable", "surface": "cli", "default_mode": "enabled", "risk": "low", "evidence": "Disable runtime"},
    {"id": "memory:pending", "name": "Pending Candidates", "maturity": "stable", "surface": "cli", "default_mode": "enabled", "risk": "low", "evidence": "List pending approvals"},
    {"id": "memory:pending-governance", "name": "Pending Governance", "maturity": "stable", "surface": "cli", "default_mode": "enabled", "risk": "low", "evidence": "List governance items"},
    {"id": "memory:qdrant-collection-audit", "name": "Qdrant Collection Audit", "maturity": "stable", "surface": "cli", "default_mode": "enabled", "risk": "low", "evidence": "Read-only audit"},
    {"id": "memory:qdrant-alias", "name": "Qdrant Alias", "maturity": "stable", "surface": "cli", "default_mode": "enabled", "risk": "low", "evidence": "Collection aliasing"},
    {"id": "memory:trusted-agent", "name": "Trusted Agent", "maturity": "stable", "surface": "cli", "default_mode": "enabled", "risk": "medium", "evidence": "Scope-based token"},
    {"id": "memory:embedding-manifest", "name": "Embedding Manifest", "maturity": "stable", "surface": "cli", "default_mode": "enabled", "risk": "low", "evidence": "Model config, dims, version"},
    {"id": "memory:outbox-recovery", "name": "Outbox Recovery", "maturity": "stable", "surface": "cli", "default_mode": "enabled", "risk": "medium", "evidence": "Read-only check, dry-run"},
    {"id": "verify:open-source", "name": "Open Source Verification", "maturity": "stable", "surface": "cli", "default_mode": "enabled", "risk": "low", "evidence": "Secret scan, preaudit"},
    {"id": "open-source:preaudit", "name": "Open Source Preaudit", "maturity": "stable", "surface": "cli", "default_mode": "enabled", "risk": "low", "evidence": "Pre-release checks"},
    {"id": "memory:parity-audit", "name": "Memory v2 Parity Audit", "maturity": "stable", "surface": "cli", "default_mode": "enabled", "risk": "low", "evidence": "Read-only normalized source parity check"},
    {"id": "mcp:recall", "name": "MCP Recall", "maturity": "stable", "surface": "mcp", "default_mode": "enabled", "risk": "low", "evidence": "MCP protocol recall"},
    {"id": "mcp:write", "name": "MCP Write", "maturity": "stable", "surface": "mcp", "default_mode": "enabled", "risk": "medium", "evidence": "MCP protocol write"},
    {"id": "memory:auto-approval", "name": "Auto Approval", "maturity": "beta", "surface": "cli", "default_mode": "disabled", "requires_apply": false, "risk": "medium", "evidence": "Scoped add-only, production guard"},
    {"id": "memory:auto-approval-sweep", "name": "Auto Approval Sweep", "maturity": "beta", "surface": "cli", "default_mode": "disabled", "requires_apply": false, "risk": "medium", "evidence": "Sweep with guard"},
    {"id": "memory:auto-approval-limit-advisor", "name": "Auto Approval Limit Advisor", "maturity": "beta", "surface": "cli", "default_mode": "disabled", "risk": "low", "evidence": "Limit recommendations"},
    {"id": "memory:auto-approval-ops", "name": "Auto Approval Ops", "maturity": "beta", "surface": "cli", "default_mode": "disabled", "risk": "low", "evidence": "Operational scripts"},
    {"id": "memory:auto-update", "name": "Auto Update (dry-run)", "maturity": "beta", "surface": "cli", "default_mode": "disabled", "requires_apply": false, "risk": "medium", "evidence": "dry-run/explain mode", "notes": "Use --dry-run for safe operation"},
    {"id": "memory:conversation-sources", "name": "Conversation Sources", "maturity": "beta", "surface": "cli", "default_mode": "disabled", "risk": "low", "evidence": "Source discovery"},
    {"id": "memory:conversation-monitor-report", "name": "Conversation Monitor Report", "maturity": "beta", "surface": "cli", "default_mode": "disabled", "risk": "low", "evidence": "Monitoring report"},
    {"id": "memory:intelligence-quality", "name": "Intelligence Quality", "maturity": "beta", "surface": "cli", "default_mode": "enabled", "risk": "low", "evidence": "Quality assessment"},
    {"id": "memory:quality", "name": "Quality Assessment", "maturity": "beta", "surface": "cli", "default_mode": "enabled", "risk": "low", "evidence": "Quality metrics"},
    {"id": "memory:trace-feedback", "name": "Trace Feedback", "maturity": "beta", "surface": "cli", "default_mode": "enabled", "risk": "low", "evidence": "Feedback collection"},
    {"id": "memory:graph-health", "name": "Graph Health", "maturity": "beta", "surface": "cli", "default_mode": "enabled", "risk": "low", "evidence": "Graph health check"},
    {"id": "memory:embedding-calibrate", "name": "Embedding Calibration", "maturity": "beta", "surface": "cli", "default_mode": "disabled", "risk": "low", "evidence": "Calibration report"},
    {"id": "memory:policy-eval", "name": "Policy Evaluation", "maturity": "beta", "surface": "cli", "default_mode": "enabled", "risk": "low", "evidence": "Policy evaluation"},
    {"id": "memory:policy-corpus", "name": "Policy Corpus", "maturity": "beta", "surface": "cli", "default_mode": "enabled", "risk": "low", "evidence": "Policy corpus"},
    {"id": "memory:policy-report", "name": "Policy Report", "maturity": "beta", "surface": "cli", "default_mode": "enabled", "risk": "low", "evidence": "Policy reporting"},
    {"id": "memory:policy-backfill", "name": "Policy Backfill", "maturity": "beta", "surface": "cli", "default_mode": "disabled", "risk": "medium", "evidence": "Policy metadata backfill"},
    {"id": "memory:governance", "name": "Governance Report", "maturity": "beta", "surface": "cli", "default_mode": "enabled", "risk": "low", "evidence": "Read-only governance"},
    {"id": "memory:governance-audit", "name": "Governance Audit", "maturity": "beta", "surface": "cli", "default_mode": "enabled", "risk": "low", "evidence": "Governance audit"},
    {"id": "memory:evolve", "name": "Memory Evolve Report", "maturity": "experimental", "surface": "cli", "default_mode": "disabled", "risk": "low", "evidence": "Aggregated governance report", "notes": "Combines all governance reports into single view"},
    {"id": "memory:debt-plan", "name": "Debt Plan Report", "maturity": "experimental", "surface": "cli", "default_mode": "disabled", "risk": "low", "evidence": "Debt planning report"},
    {"id": "memory:self-improvement", "name": "Self Improvement Report", "maturity": "experimental", "surface": "cli", "default_mode": "disabled", "risk": "low", "evidence": "Recommendation report"},
    {"id": "memory:graph-report", "name": "Graph Report", "maturity": "experimental", "surface": "cli", "default_mode": "enabled", "risk": "low", "evidence": "Read-only graph analysis"},
    {"id": "memory:code-graph", "name": "Code Graph", "maturity": "experimental", "surface": "cli", "default_mode": "disabled", "risk": "low", "evidence": "Project isolation test"},
    {"id": "memory:temporal-policy", "name": "Temporal Policy", "maturity": "experimental", "surface": "cli", "default_mode": "disabled", "risk": "low", "evidence": "Time-based policy"},
    {"id": "memory:temporal-sweep", "name": "Temporal Sweep", "maturity": "experimental", "surface": "cli", "default_mode": "disabled", "risk": "low", "evidence": "Temporal cleanup"},
    {"id": "memory:decay", "name": "Memory Decay", "maturity": "experimental", "surface": "cli", "default_mode": "disabled", "risk": "low", "evidence": "Decay simulation"},
    {"id": "memory:consolidate", "name": "Memory Consolidate (report)", "maturity": "experimental", "surface": "cli", "default_mode": "disabled", "requires_apply": false, "risk": "low", "evidence": "Consolidation candidates", "notes": "Use --dry-run for safe operation"},